{"$schema":"https://json-schema.org/draft/2020-12/schema","$id":"https://rehostrace.example/schemas/target_manifest.schema.json","title":"RehostRace target manifest","type":"object","required":["schema_version","target_family","version","components"],"properties":{"schema_version":{"const":"rehostrace.target-manifest/v1"},"target_family":{"type":"string"},"version":{"type":"string"},"components":{"type":"array","minItems":1,"items":{"type":"object"}}},"additionalProperties":false}
